name_y,avg_rating,resumen_reseñas,longitude_x,latitude_x,num_of_reviews,distancia
Southern Charm Cafe,4.8,Porky Pig omelet was excellent. Corned beef hash was cooked to order.,-80.60994869999999,28.3928276,1728,192.9728716345702
Wise Guys Pizzeria,4.3,The pizza weighed about half of what it should have. Very thin crust.,-80.60598499999999,28.390663,38,192.6406676535347
Harbortown Marina - Canaveral,4.6,The best  Good Marina great service go people awesome food awesome awesome awesome love the place I've been here 3 years on my God I love this place,-80.680109,28.4071506,68,196.39022639198518
Banana River Market,4.9,What a great surprise. This place is just awesome.,-80.6651607,28.3607652,25,191.04562961748368
Space Coast Auto Center,4.1,Great customer service and they know what they’re doing. I’ve had several vehicles serviced here throughout the past few years and the work they do is always top notch and they don’t try and sell you on needless procedures.,-80.7068812,28.4134275,28,197.83163075672215
Chick-fil-A,4.6,It has been ages since I had gone into a Chick-fil-A and upon entering all the employees seem to be very happy and cheerful. They seem to all get along with one another which creates a wonderful work environment.,-80.68632939999999,28.3565581,1273,191.21501334307843
Subway,3.8,I'm a picky eater and Jonathan made my sandwich better ham perfect. He and Ash were superb!!!,-80.68680479999999,28.3541138,16,190.97083386350087
Outback Steakhouse,4.4,It was full and we had to wait for a moment but we understood. I will be coming back and I would recommend this place to friends and family.,-80.684152,28.3565376,1545,191.14857925275712
Popeyes Louisiana Kitchen,3.7,Ordered a white 4 combo with an extra biscuit. Paid more for all white and extra biscuit.,-80.7015287,28.3572377,1335,191.74138969066675
Pacific Rim,4.5,"I ordered the King Kong combo which consisted of Monkey Brains, Monkey Leg, Monkey Thumb and Monkey Tail - none of which contain monkey. I had so much leftover but I have a hungry teen at home, so it won't go to waste.",-80.6996948,28.3617768,1193,192.16466653884558
Pho 95 Vietnamese cuisine,4.7,"Yum! Their pho broth is so delicious and fragrant, we also had the Bahn Mi, egg rolls, and crab puffs.",-80.7419754,28.3746033,248,194.82214969638355
Subway,3.8,"Their ""grilled"" sandwich was heated in a special microwave bag providing ""grill"" marks. Picture of sandwich on menu board appears pressed, maybe sandwich maker should hand press sandwich in bag before microwaving.",-80.7540053,28.3957478,156,197.4216051765871
Beef 'O' Brady's,4.2,I was a little disappointed with the flavor of the prime rib. The chicken bowl was very good with the pablano sauce which had a delightful spice.,-80.7645684,28.3952002,538,197.70450030769865
La Placita,4.2,"La placita is a small supermarket with small restaurant in back. Good food, good prices and friendly service.",-80.7435983,28.3737472,668,194.78409810506386
Subway,4.1,The Sub Chef was very good and nice. The bread was good as well.,-80.73963169999999,28.3759308,248,194.88696601156587
Tequila Veintiuno Mexican Cuisine,4.5,Fantastic food and service. Had the special and it was great.,-80.76618069999999,28.3952969,55,197.76697866337722
Jabbers Bar & Grill,4.4,Great place. Very clean and welcoming.,-80.7871888,28.4290682,580,201.98195373575953
McDonald's,3.5,"Yummy... to state it straight forward... amazing, never in the course of human history has any restaurant been able to make a mix of flavors as delicious and bold as this restaurant. I would recommend any person going through Florida must go here.",-80.7977915,28.5685329,1846,216.93273772690813
Shiloh's Steak & Seafood,4.2,"Hubby and I were staying nearby and looking for a waterfront spot and Shiloh's did not disappoint! Our waiter Travis was excellent, friendly, and attentive.",-80.7980201,28.57338,2241,217.4493744053852
Frankie's wings,3.9,Great food and friendly staff! Best wings in town.,-80.8041423,28.5865505,68,219.0235806347284
China Wok,3.9,How you gonna not send silverware with a doordash order to a HOTEL.....sad.,-81.3271295,29.9246278,100,375.8035585992474
Fire Wok,4.3,For quick Chinese it was surprisingly very good! Food was hot and had good portions.,-81.29268689999999,29.9170942,164,373.94962727637704
Ben's Soft Pretzels,4.3,"They were out of what we wanted to order, the chicken bacon ranch things, but what we got in place of that was delicious! They were also out of nacho cheese the day we were here, but the cheddar cheese was acceptable.",-81.3132651,29.8960132,88,372.36917468380636
The Pretzel Lady,4.6,The place is very tidy and clean. The pretzel brat was great with several choices of mustard.,-81.3294918,29.8786326,18,371.05716624489077
The Floridian Restaurant,4.5,"Items on the menu had unique twists to the American staples. Food was extremely tasty and homemade, as someone who loves to cook and feed people ( with great reviews of my cooking) this is tough sometimes when we go eat out but I was not disappointed at all by the Floridian!",-81.3137667,29.8939334,2273,372.16659525046146
Pizzalley's Chianti Room,4.6,Unexpected surprise! Walking through St Augustine historic district and stumbled across this gem.,-81.3122112,29.894273,2158,372.15375099113896
"Harry's Seafood, Bar & Grille",4.6,He set the stage and we knew we were in for a treat. It was a beautiful view.,-81.3113053,29.893406,8116,372.03456662548206
Llama Restaurant,4.7,"Amazing little Peruvian restaurant. This place is only open for dinner, and there are only 9 tables, so you should make a reservation.",-81.296325,29.8904,468,371.2549934669751
Mellow Mushroom St. Augustine,4.4,I ordered a gluten-free pizza with vegan cheese. I was so hungry by the time we got our food that I ate half the pizza before realizing that the crust didn't taste gluten-free.,-81.2964725,29.8910636,2104,371.3292561069983
Acapulco Mexican Restaurant,3.4,"The margarita I got was strong but not too strong, it was just right. If you like Mexican food and you are in St Augustine this is a MUST!",-81.3114722,29.8957537,25,372.2861249041714
The Original Likit fish & chips,3.9,"The food is decent for being a walk up spot, but didn't care for the prices ($12 for fish and chips) About what I expected for the area though.",-81.3133628,29.8972189,18,372.4987295535128
CLOSED Howie's Pizza,3.5,Howies is not closed. Good buffet for great price.,-81.318759,29.906054,68,373.59389456816257
Angela's Restaurant Supplies,4.6,"I love coming here and just looking at stuff, it’s a lot of fun",-81.3203449,29.9104148,28,374.10085327728655
Tropicali Food Truck,4.7,"I loved the creativity and the positive energy! Grilled sheeting was excellent, had that grilled flavor, honestly the best shrimp I'd had out lately!",-81.3206372,29.8968604,58,372.68830785224714
The Sprout Kitchen,4.8,"First time in St. Augustine and found this gem. I had the ""Lox"" and it was amazing!",-81.31181389999999,29.8939072,55,372.10299465245754
Pampa - South American Kitchen,5.0,The food and service in this place is FANTASTIC!! I had the beef sandwich and my wife had the chicken.,-81.3472563,29.9153198,144,375.461906928159
900º Pizza and Pasta,4.7,"We also had the white pizza delivered, and tried the ultimate pepperoni in house. I am now in love with this place, and am trying to figure out when I'll order again, while my husband is driving home and we have a whole pizza in the backseat.",-81.341329,29.927368,27,376.5362112036004
Southern Vibes Tasting Room and Wine Cellar,4.7,Southern Vibes is a wonderful place for your favorite wines and beer. The atmosphere is so classy and warm.,-81.4892682,29.9610477,28,384.93027458536966
Villagio,3.9,Had the most bitter steak I ever ate. The Insulata was good but the steak was small and bad.,-81.4681799,29.9898002,46,387.191374784308
Domino's Pizza,3.0,"Great pizza, but don't appreciate having to wait 10 extra minutes when the app says it is ready. Apparently they made it wrong because they can't read.",-81.5143997,30.0612908,177,396.17831947151365
Tank's Sushi Bistro (Nocatee),4.7,Really fresh and good sushi. We had some appetizers and 4 rolls.,-81.41549739999999,30.1085686,106,397.85817452202065
Grumpy's Restaurant,4.8,"Grumpy’s is a great diner where you grab breakfast or lunch. This new location is very nice, great building and very friendly staff.",-81.49522739999999,30.0679699,18,396.22211120030846
Kotobuki Asian Cuisine,4.8,This is definitely a hidden gem. Sushi was made to order right in front of you.,-81.4387224,30.0663502,78,394.18661206396024
Bala's Pizza,4.8,Really friendly staff. Place looks great.,-81.4967921,30.1035316,48,399.9711086194507
McDonald's,3.0,"It's a McDonalds, but the employees are competent, so 5 stars.",-81.51087199999999,30.2157571,894,412.1237618204625
Domino's Pizza,3.9,"Had the penne pasta baked in bread for lunch. Was very good, hot fresh.",-81.3872792,30.2258992,88,409.3152364294854
Lil Wok,3.9,We have been to Lil Wok several times over the past 18 months we have lived in Sawgrass. The food was OK until this weekend when it rounded the corner to VERY GOOD!,-81.389062,30.226939,78,409.47824653367996
The Plantation House,4.5,Worked a wedding here for really good friends. It was nothing less than amazing!,-81.3760624,30.1649299,48,402.55760064512606
Red's Steakhouse,4.7,"Quality: tossup with Longhorns Food served warm, not hot I’ve had better Harris Ranch Overall:Meh",-81.388128,30.225937,25,409.3446759475905
Ruth's Chris Steak House,4.5,We walked in on a Friday evening and found two open seats at the bar!! Everything was on point.,-81.38087449999999,30.2009929,688,406.49958467341037
Caffe Andiamo,4.1,Service at this restaurant was absolutely top notch. Our server helped guide us through menu and drink suggestions and we loved everything she suggested.,-81.382572,30.204637,305,406.93438886205246
Salt Life Food Shack,4.3,"GREAT service....we had Alda and she was super friendly. Ambience was on point here, and I'm glad they have the tables spaced out a bit due to covid, a lot of places seem to not care.",-81.39404669999999,30.2977583,2065,417.0919998428043
Milano's Italian Restaurant Pizza and Bar,4.4,Food was very good. Don't order the minestrone.,-81.395162,30.302201,603,417.5936481086878
V Pizza & Flask&Cannon - Jax Beach,4.6,"Best pizza ever. Made with quality ingredients, some even imported from Italy Everything is hand made.",-81.3907189,30.2937768,1264,416.5736421208771
Pita Pit,4.5,1st time trying out. Got chicken Cesar..grilled chicken & bacon??,-81.393001,30.293073,564,416.56682216154087
Le Petit Paris Café Atlantic Beach,4.8,"I even overheard someone say they drove a long way to get here, I was excited to try the food! The soda machine wasn't working when we went in, what a great opportunity to have a deliciously crafted Vanilla latte with oat milk.",-81.39818989999999,30.3250525,28,420.0941863271269
Ocean 60 Restaurant,4.5,Attended Friday’s happy hour and it was great! Can’t believe we didn’t try this place earlier.,-81.3963323,30.3252495,298,420.06033783645273
North Beach Fish Camp,4.6,Great way to start on our first getaway in a while. We had a fun time at the bar.,-81.3962806,30.3244452,1702,419.97392278451997
Hop Shing,3.6,"Good food, quick service. The kind of chinese that leaves you feeling fill yet an hour later wakes up the tummy for more!",-81.4127881,30.3255677,68,420.580403440828
Taste Of Soul,4.2,Good homestyle food and quick friendly service. I had the smothered pork chops with sides of collards and mac n cheese.,-81.4145459,30.3350811,17,421.635662757045
Bono's Pit Bar-B-Q,4.3,"Great great great BBQ. The service is always top notch, staff is very pleasant and makes you feel like you're at home.",-81.4105174,30.3231015,628,420.25290415020123
New Wok,4.2,Very nice food,-81.4059595,30.2997938,126,417.6601652189537
Pinto Thai Bistro,4.8,Wow this place is phenomenal. This is some of the best Thai food I have had here in Jacksonville.,-81.39078239999999,30.28095,85,415.2224130069698
Mr. Taco,4.7,Really great authentic Latin street food. Three tacos for $8 with everything on them.,-81.4018214,30.288029,68,416.2967850825268
BurgerFi,3.8,Fries were delicious and the burger was good but did not have correct ingredients asked for. Onion rings were thick which made them pretty raw inside and some of the batter was not fully cooked.,-81.40428709999999,30.3226827,35,420.02405690833393
Third Street Diner,3.8,Delicious! I knew that I liked Gyros but I learned that I liked grape leaves today.,-81.3898208,30.2801813,848,415.11285654553984
Jax Beach Brunch Haus,4.6,This place is AMAZING! Food was so delicious!,-81.39082789999999,30.28225,884,415.36087680255235
Cruisers Grill,3.9,Been craving a little big salad with marinated chicken and honey mustard on the side for a few weeks but turned around the previous two times due to crowded parking. This time decided to park at Panera and skip over.,-81.389017,30.269288,816,413.94016322198604
Fla Juice & Bowl,4.5,The Green bowl and Fla bowl were so delicious with honey! We got nitro coffee with caramel and oat milk.,-81.388108,30.26803,178,413.780529197558
Moe's Southwest Grill,4.2,Welcome to Moe’s! It’s a chain and quality is consistent.,-81.389669,30.268042,236,413.82813058364087
LongHorn Steakhouse,4.5,We ordered the baby back ribs which were nicely seasoned and had a little cup of BBQ sauce that had a little kick to it. We also ordered a NY strip steak with a side of mashed potatoes and a house salad which was perfectly seasoned and cooked medium as ordered.,-81.3933031,30.255382,751,412.60186512058016
Sierra Grille,4.6,Its always good and clean food. I feel like it’s some of the freshest ingredients and I can tell the difference in taste.,-81.38919949999999,30.2537248,612,412.3047573532933
The juicy,4.8,"AMAZING oysters, crab, shrimp, & lobsters. Good prices & they beat the Crab Shack & Fish Company!",-81.4144987,30.3350908,53,421.635283910484
Que Pasa Mexican Kitchen,4.3,Dined on a Thursday at lunch time with friends. Took 30 to get my order in and then another 30 minutes to get my barely warm food.,-81.39573879999999,30.3040269,342,417.80331995966105
Yoon's Spoon,4.9,The spring rolls were large and bursting with the flavors of fresh vegetables. The dining experience had a family feel.,-81.44094199999999,30.2886047,34,417.53892053322926
Surfwiches Sandwich Shop II,4.8,They have awesome sandwiches!,-81.439818,30.286427,16,417.2756480782205
Mambos Cuban Café,4.5,"Don't get some of the hate I've seen Mambos get. Sure, it's not the best cuban food I've ever had, but it's pretty darn good.",-81.4543291,30.2871761,1682,417.80051668814787
Chipotle Mexican Grill,4.1,Convenient to work and home. Quick walk-in service and enough good tasting food to satisfy most appetites without feeling stuffed.,-81.4603684,30.2871128,634,417.98083146362967
Einstein Bros. Bagels,4.0,"Great service every time I go! Love their ice coffee, mocha, cream, no sugar.",-81.5092236,30.2718955,35,417.93042311896863
Boathouse at Student Union,3.8,"The location is very nice, open and welcoming. I went on a Monday night and they had karaoke.",-81.50945159999999,30.2716682,28,417.9140040041622
Gene's Seafood Restaurant,3.8,"The fried scallops, shrimp and clams tasted all like it was frozen food not a far memory from Long John Silvers. I was disappointed with the all the food except for the hush puppies.",-81.6439742,30.2612967,58,421.3511709813135
Cantina Laredo,4.3,I would give Cantina Laredo five stars for service and four for the food. We have eaten there twice and enjoyed both experiences.,-81.52567239999999,30.2528201,952,416.4720948921128
Hana Yori Sushi & Grill,4.7,I've been there before with friends and it was excellent. There hours are from 4:30 to 9:30 each day posted on the door.,-81.4956868,30.2866106,557,419.0366627744592
A Bit of Saigon,4.6,Food was fast and hot. No one in here.,-81.4887056,30.2854333,148,418.69224950095884
Epik Burger,4.4,Awesome. Great burger and fries.,-81.473148,30.317466,1202,421.5623807803605
Cinco De Mayo,4.3,This place serves😋delicious Authentic 🇲🇽Mexican🇲🇽cuisine at a🤑reasonable price. The steak fajitas are my favorite.,-81.49138889999999,30.3191667,1252,422.31012486429984
Sake House,4.4,Love this place! The owner is super knowledgeable about the sushi and posts specials on their Facebook page as soon as fresh product comes in.,-81.4870411,30.2858594,58,418.68427265125706
Cajun Boil Express,5.0,This place is amazing The seafood is rapidly brought out to you with great customer service. They have a promotion for purchasing five rice bowls getting the six rice bowl for free and let me tell you getting these rice bowls makes it easy to get to the sixth one.,-81.43885089999999,30.2884401,48,417.45766317626413
China Wok,3.9,I order the  Bourbon chicken And it was very dry and hard. The egg roll was burned.,-81.4646114,30.2542322,28,414.6650529211541
Starbucks,4.2,"Love it but could not give a 5 star due to the prices. However, the staff was so great.",-81.45839,30.320892,798,421.4664623110018
London's Fish N Chip,4.1,"They had plenty of ""Fish and Chip"" options on the menu, but I was not very impressed with the food that I was served. After being served and having a while to eat and absorb the environment, I would have to say that London Fish and Chips needs some serious improvements if they are going to make it.",-81.4966864,30.2865933,98,419.0665989732713
McDonald's,3.1,Every morning I come and get breakfast there under staffed and it takes 20 min to get my order with no one in line in front of me. I thought this was supposed to be FAST FOOD.,-81.50227749999999,30.3606285,1305,426.99677183948086
Subway,3.9,Nothing about this location feels clean enough to eat at. The staff didn't wear masks either time I went here- the first time was before the mask mandate was lifted.,-81.4118864,30.3860667,92,426.93727920804764
Cabalen Restaurant,4.5,Great place for a quick bite,-81.4143814,30.3509905,54,423.3086314204763
Bantam & Biddy,4.5,great atmosphere and friendly staff. The sides were fresh and well seasoned.,-81.4568443,30.5914437,128,449.94733637328875
Coast,4.2,Do they offer a vegetarian menu? Yes.,-81.4446617,30.5941123,37,449.8822563917814
Mustard Seed Cafe & Juice Bar,4.5,A healthy and tasty cafe located in the Nassau health food store. They have vegan options that are perfectly prepared and brought to your table.,-81.45703639999999,30.6459289,75,455.7208277862022
Jimmy John's,4.6,"When a resteraunt says they treat you like family this one embodies it. The staff is extremely friendly and wants you to have the best experience, we always do.",-81.45306769999999,30.6406027,108,455.0444338121213
Island Kitchen,4.6,Nice find! Food excellent and service was outstanding!,-81.46316999999999,30.671715,58,458.6258334752661
V Pizza,3.8,"Great experience with takeout! They text you when your order ready, which is really handy.",-81.4384137,30.6393178,37,454.496403876697
GRAB’N’GROW,4.9,Wow this place is great! A real hidden gem on the island.,-81.4590145,30.6409946,38,455.25422026801976
V Pizza - Fernandina Beach,3.9,"My husband and I take our family out to fine dining on the regular and understand we are going to spend $200+. Your staff should be wearing floor length aprons  We ordered 3 create your own pizzas as my 4 year old shared with my husband, my daughter and I shared the 14 inch gluten free option and my 17 year had his own.",-81.4384137,30.6393178,45,454.496403876697
Pizza Hut Express,4.0,A hit and miss with them. Could use a good cleaning.,-81.55325169999999,30.630333,38,456.88898104290297
China 1,3.7,"Good food and pricing, however they are never there before 12 so they need to update hours.",-81.91954799999999,30.694547,84,475.77455437807373
Little Caesars Pizza,3.3,"My feelings are hurt  My most favourite pizza is the pretzel pizza I got my 2nd one from this place ,yet again ,I was disappointed The pizza wasn't cooked all the way It was  Still doughy  Wasn't actually hot. It bugs me for being the cullahnary industry for almost 30 years That people still can't take pride in their job and all they do it is for a paycheck",-81.91694,30.690954,108,475.3112079487363
Callie Kay's Deli,4.8,Good subs. Fair price.,-81.93973539999999,30.7216537,68,479.2892334375398
Connie's-Pizza & Bar Bq,4.3,"Veggie pizza and bbq wings were delicious, did not get pics this time😞, excellent service will be a repeat customer",-81.91666889999999,30.691194,58,475.3259788293053
Callahan Barbecue,4.6,Comfortable atmosphere. Very friendly staff.,-81.82740799999999,30.56812,1157,459.4650430361335
Wasabi Sushi & Grill,4.1,It's ok I guess. The floors were dirty and the service could've been better.,-81.82640549999999,30.5682057,188,459.4380071051612
Pizza Hut Express,3.6,Had enough points for a free pizza. Love the staff and their rewards program.,-81.6518972,30.6194723,17,458.82717281627157
The Hidden Crab,4.6,I was there today and number #5 combo was recommended in hot. I did get the mild with hot on the side.,-81.5162036,30.6168853,37,454.3640865784436
Subway,3.4,Not a fan cant stand the smell of the store never really had any luck w the food either,-81.53380469999999,30.6193564,28,455.14857645372126
Subway,3.8,Super fresh bread and toppings. Better than any Subway in Orange park where i live.,-81.6469857,30.4813707,48,444.2699873710845
McDonald's,2.8,Super friendly people as in many of the McD's that we go into lately. Thank you keep up the good work.,-81.6357396,30.4802167,1810,443.7782752594894
Osaka Japanese Steak House,4.0,The sushi was fresh and delicious. This restaurant offered a large variety of sushi 🍣 rolls.,-81.82857349999999,30.1979689,822,421.7128997759008
Ship 2 Shore Seafood & Steaks,4.1,Food is really good and our server was great. She was very polite and friendly.,-81.6696382,30.4313992,1370,439.83980498813486
Popeyes Louisiana Kitchen,3.3,I think they getting better. And my chicken was fresh and hot.,-81.66852469999999,30.4294509,997,439.5999415531293
Jamrock Caribbean American Cuisine,4.3,"We had Escovitch Parrot Fish (all fish is fresh and made to order but trust me it is worth the 20 minute wait) with rice and peas (not red peas we are talking real Gungu Peas) cabbage that will make your mouth water, fried Plantains, calaloo and of course you can’t have real Jamaican food without a Red Stripe Beer. Listen I have had Jamaican food in many states and in Jamaica and few come close to the fine food David makes at Jamrock.",-81.6849323,30.4040633,118,437.53223028222465
Subway,3.3,Um what time do they open 7 or 8? I've been sitting outside craving a sub since 6:45.,-81.6739898,30.3565939,38,432.24409028169765
Bono's Pit Bar-B-Q,4.0,I ordered my food online arrived expected pickup time. To only find out my order wasn’t available or received and had to replace my order.My Husband ordered a LARGE RIB PLATTER and received like 6 bones they were dry as hell the sides weren’t bad but the meat was trash.,-81.66573799999999,30.374941,843,433.8570576435963
Subway,4.0,Wasn't even  through the front door and the employee was shouting at the customers that nothing was in stock. They do not have any breads only wraps.,-81.65409869999999,30.3572591,267,431.62646275773096
A Taste Of Miami,4.2,The chicken wings fall off the bone! The food is delicious and i had no idea that i was partaking in vegan entrees.,-81.6698892,30.4295196,53,439.6534511450473
Chick-fil-A,4.1,Always good food from Chick-fil-A,-81.6063076,30.3518244,38,429.44386994619055
Subway,3.6,It was ok the subway girl hooked us up on the sub but the lady that works in the circle k was just loud and rood take it down a notch hon if they wanna eat out side let them,-81.5239878,30.3472209,28,426.27781805449143
Krystal,3.2,Time never updated on any of the fast food over here. Saturday shows closing at 1:00am.,-81.56125109999999,30.3527846,910,428.05805216662174
Little Caesars Pizza,3.7,"Some days are fine. Others I pull up, they look me dead in the face and walk away.. and then when the same person does it AGAIN in a 5 minute period...",-81.57065999999999,30.352526,666,428.33800772702875
Seven Wonders Bakery,4.5,Great place to enjoy Haitian Cuisine if you are patient enough to wait a while. I genuinely enjoy the food there.,-81.6023285,30.3440511,73,428.5028858525568
La Palmerita,4.7,I love this restaurant. Authentic Hispanic foods..,-81.5777432,30.3536837,77,428.6908488896148
IHOP,3.8,Food was ready 20 minutes after pickup. It's busy so it's whatever.,-81.5616565,30.314576,2525,424.087810512555
Rice & Noodles,4.9,"Delicious glass noodles and the dumplings are perfect. The cost was a bit much ,the portion size was not!!",-81.5512415,30.3267541,308,425.01689901967325
Sonic Drive-In,3.2,We told the employee assisting us we did not want the order and we were not offered a replacement order. As we paid through the app the only way to get a refund was to go through the app.,-81.5481609,30.3301895,1553,425.2752296320861
Zaxby's Chicken Fingers & Buffalo Wings,4.1,Just got back from this location with my girlfriend and found dead bugs in our salad.,-81.54923,30.33048,1428,425.34024754349775
Fit Meals Prep,4.8,"Excellent meals and always delivered on time. They make my week so much easier because the food is easy, ready to eat, and very tasty!",-81.518776,30.324221,144,423.70609233135144
Living Stream Church,4.6,"Great place to connect with the community. Enjoy the worship, meeting people, and experiencing God in a new way 🙌🏻💯😎",-81.542538,30.314357,178,423.4405467069761
Krystal,3.3,Decided to get some mini burgers after taking the kids out for a round of putt putt. Rolled through drive through and asked if I could get a 24 pack and the employee working the mic explained that there would be at least a 30 minute wait since the 3 vehicles in front of us made the same order.,-81.5383507,30.322546,928,424.15967696834974
