name_y,avg_rating,resumen_reseñas,longitude_x,latitude_x,num_of_reviews,distancia
Checkers,2.3,I normally go to to checkers on Dixie and the cashier was rude. Was more interested the conversation that I was interrupting.,-80.0884023,26.6282388,17,9.254095239987496
Rey Tacos,4.4,So my wife says let's try Rey tacos. We do.,-80.05299029999999,26.5835502,65,15.012417928347997
Bella Pizzeria,4.8,On the delivery side: It came quickly and was hot. I didn't have my extra sauce on the side but that was okay.,-80.0527283,26.617493,28,11.59008707124052
Blues & BBQ,4.5,I came here spontaneously with my friend and it was pretty good here. The food was very presentable and tasted well.,-80.0950098,26.5353174,18,19.40088754143386
Pizza Hut,3.2,"These guys are like an operation right out of the first Blade Runner movie sans the neon lights. It’s important to show sympathy, empathy, and all of the necessary sensitivity traits humankind can possess.",-80.0594437,26.513386,88,22.300944784529904
Chinatown,3.8,Everytime the special fried rices is different. Last time it was bland and the color says it all.,-80.0614338,26.5137626,190,22.218944079473886
Secret Garden Cafe,4.4,"This is a very cute, hidden place. It is a coop kitchen so the menu is small.",-80.06043369999999,26.5286974,18,20.62372963321597
Le Bon Gout Restaurant,4.5,"The Owner is a great human being with a bigggg Heart from Heaven, always on the side of helping anyone in need.",-80.0561151,26.5998331,118,13.220899496976882
Bonzouti Resturant,3.9,They never give enough dressing for the salad. You have to ask for extra everything to get enough to cover the rice.,-80.05657699999999,26.5414867,34,19.341282471605826
Robinson BBQ,4.5,"This spot is awesome! Fair pricing, considerable portions and the staff are constantly very nice.",-80.0630889,26.5359011,78,19.786740892375516
Casa Linda,4.3,I had such an amazing experience at this restaurant. The food is so fresh and the service impeccable.,-80.0920022,26.5350863,917,19.44697103735534
Sarku Japan,4.6,"One of my go-to places to eat. great location, well kept, and good customer service.",-80.0951958,26.5358432,48,19.341615991587467
Dunkin',3.8,A nice place to visit. But I wouldn't want to live there.,-80.09464229999999,26.5254162,18,20.49811955366453
CLOSED Hungry Howie's,4.1,This location is always quick good and accurate. Great prices.,-80.08966389999999,26.5115414,38,22.065851271967627
Nini's Pizza & Italian Cuisine,4.0,"I came in to order a pizza and an entree to go. 60 minutes later, I was still waiting.",-80.0767937,26.5169392,18,21.60983165335231
Higher Ground Cafe,3.7,Sparkling clean and very friendly atmosphere. Delicious coffee.,-80.0893693,26.4956803,57,23.82040989213406
Taco Bell,4.3,"All is fine with the service, but the prices are a $$&1/2 for less of everything and be sure to give T.B. the number of sauce you need.",-80.06009999999999,26.5076,18,22.914504856807852
Marianne Gourmet,4.4,Great friendly place to eat great food made to order. Great people with a personal touch.,-80.0651139,26.4743777,17,26.44601318574363
Sande's Restaurant,4.6,We were able to choose our own table although we were offered to sit in the back of the restaurant. The French toast was delicious and the orange juice was pretty good.,-80.06558489999999,26.4828983,547,25.50652512494061
East Delray Delivery Dudes,3.5,Cowabunga dudes.,-80.0723242,26.4636571,36,27.52063604126879
A to Z Picture Framing,4.9,I took very sentimental pieces of my father’s history in the Korean War to Az for framing. What he did was phenomenal.,-80.0709976,26.4682322,68,27.03493886499068
Aloha Dry Cleaners & Alterations,4.2,"This place did an excellent job on my bed comforter. They were extremely friendly, timely and also gave me the best deal around compared to other places I had called.",-80.0677637,26.4654629,46,27.383088582277562
Planet Smoothie,4.4,"This was my first time at a Planet Smoothie, so I wasn't sure what to expect. I experienced friendly customer service and fast and efficient order processing.",-80.0924617,26.5298283,24,20.024561891862607
Ceasar's Famous Ribs,4.6,Fall off the bone goodness! Suggest getting the sauce on the side to first enjoy the great smoky flavor.,-80.07791569999999,26.4608011,65,27.771227201297897
Subway,4.2,This is probably the biggest Subway I've ever been inside of. It's a very cool building.,-82.037178,26.785969,35,192.1985717942649
Chez Tidoc Restaurant,4.2,Good food.,-80.0706673,26.4570024,18,28.272902731945692
Carpe Diem,4.4,Food was great. Happy Hour meals were filling.,-80.0719536,26.4615205,18,27.760124408511796
McDonald's - NEW LOCATION (next to Walgreen's) NOW OPEN,3.5,"The most High End Mc Donald’s EVER. Absolutely clean, modern, great ambiance, very nice to customers.",-80.0909729,26.5121421,28,21.989719859560566
HOME ANGELS Plumbing | Water | Mold | Fire,4.9,"Our hot water heater went out and they we're flexible helped us save money, and did it on time. They were honest and fair and took good care of us.",-80.0760629,26.5385277,473,19.25529723462534
Subway,3.9,Employees need to work on their customer service and treat every customer fairly.,-80.0942249,26.4587912,56,27.872134685963694
The Habit Burger Grill,4.4,everything is quality.special mention the Vanilla shake.congratulations.it was my first time and I'm really happy.ill be back,-80.0713468,26.4386063,688,30.287599101762066
Scratch Car Automotive Paint Repair Specialist,4.9,Gave my car to fix a bumper scratch over the weekend. Fernando and team did a fabulous job.,-80.07436899999999,26.4400996,84,30.089387748635787
Linton Paint & Body,4.9,Always treated in a very professional manner.. All ways provides an expertly finished repair job... Always a fair price...,-80.0746518,26.4401229,214,30.083801064858573
The Pampa Grill,4.8,"A previous time, our friend brought their certified service dog in and they made them feel extremely uncomfortable by whispering in the back about it (we could hear them discussing no perros, because we were one of 2 tables there) It’s unfortunate, because the food is great. We should’ve spoken up about the service while we were there, but we did say in front of the owner that we should leave because he clearly wants us to.",-80.0780903,26.368927,45,37.90878916037462
Argentine Steakhouse by La Rural Boca,4.7,Good prices but nothing espectacular. The ambience and service leave a lot to be desired for.,-80.07686869999999,26.3801162,58,36.682485514828066
Stoner's Pizza Joint,4.0,Well the name says it all. Not only is the pizza good it’s fair priced and you can grab a tee shirt or two for 15$ each and be rocking the coolest pizza joint in town.,-80.0877205,26.3677969,48,37.9732997360109
Kousine Boca Raton,4.5,"My favorite restaurant in Boca!! The ambiance, the service, and of course THE FOOD!",-80.0788039,26.3656147,56,38.269465914652166
Jimmy C's Italian Deli and Market,4.9,Reviews don’t lie this place is an absolute must if you live in Boca or Delray. 15/10 would recommend.,-80.0769321,26.3824938,58,36.41942459745104
Subway,3.5,"Whoever owns this subway, you need to know your snotty little employee closed your store 30 minutes early and was not wearing masks with his friends in your store. You are overpaying your little child employee who is snotty to your customers and losing you business.",-80.07992019999999,26.3868328,78,35.91682385260266
Salad Plus Boca Raton,3.8,"I have to say that I'm very happy and satisfied every time my coworkers and I order food from Salad Plus! I personally loooooveeeee their food, it's super healthy, tasty and delicious!",-80.079217,26.3975689,38,34.736255331885054
Mama Sue's Pizza and Wings,4.4,Not sure these reviews are at all real. How do you screw up an entire order?,-80.09037579999999,26.3690287,48,37.824565549710066
Troni's pizza,4.8,Amazing! The taste is a symphony for those who are the most demanding clients,-80.0720868,26.426732,158,31.58640793635366
"Sunshine Collision Center, Inc",4.9,"Phenomenal job. Fast, efficient and wonderfully professional.",-80.0845279,26.3745543,137,37.243260941385884
House of Cheung,3.6,"Love it, best Chinese food in boca",-80.07840399999999,26.368672,108,37.93460919166155
HDWerks - A full service custom automotive workshop,4.8,Peter is fantastic to work with. HIs builds are top shelf!,-80.08772979999999,26.3570934,57,39.1576829045096
The Seed,4.5,Tiny cup of nitro cold brew will run you 5.50. Really disappointed about that.,-80.0892075,26.350844,377,39.8424863518593
Cafe ARGENTO,4.7,Great place! We all enjoyed it and will be back.,-80.087013,26.3447134,35,40.53116222600563
Giovannis Pizza,4.2,"First of all the food is always cooked perfectly and fresh! It’s delicious, you crave it!",-80.08436669999999,26.3480109,138,40.180126430877166
The Drunken Burger,4.2,One the best burgers I’ve ever had. Donnie’s a good guy.,-80.085768,26.349216,24,40.03923495444308
Souvlaki Fresh,4.3,He said few more mins I got your order 1 min before you walked in. Got in the car to check if i got the extra sauces.,-80.0850043,26.3519859,268,39.73687809857606
Sanborn Cafe,4.6,Sanborn Cafe in Boca Raton - - - Saw them featured on SDSC and decided to try them. My friend and I went today.,-80.085512,26.3509301,48,39.850942337028016
Playa Bowls,4.7,Besides having a great experience like yesterday today was terrible. Today we waited 25 minutes for a bowl and smoothie.,-80.07184869999999,26.3508778,250,39.952641783390334
Waterstone Rum Bar & Grill,4.2,"Relaxed atmosphere, right on the intracoastal. Very attentive staff.",-80.0731582,26.3392066,250,41.23010974771332
Chanson Restaurant,4.3,First time at Royal Blues Hotel. My wife and I ordered Lobster Ravioli ($30 for this dish) for room service.,-80.07596509999999,26.3148103,57,43.904106597667045
Burger Craze,3.6,This is a great option for a casual bite and for being outdoors. Our server and the wait staff were all friendly and welcoming.,-80.0759051,26.3162679,298,43.74343513316711
Sushi Song,4.3,"By far the best tasting and freshest sushi I've ever eaten, great service, and watching the sushi be prepared right behind the counter was awesome. I would highly recommend this to anyone in Deerfield/Boca/Pompano/Delray area as a must try restaurant if you live in or visit the area.",-80.0779809,26.3158522,177,43.77527383432434
Flanigan's Seafood Bar and Grill,4.4,You got to try this spot if your in the area. Food was great and the atmosphere was live.,-80.0764667,26.3166167,2098,43.7009675080676
Deerfield Delivery Dudes,4.0,I look at every complaint and can't disagree with their assessment of DD. What the suggested wait time is compared to what it actually becomes usually isn't the same.,-80.1116165,26.2931284,38,46.20042011007542
Shamrock Restoration,5.0,We had water leak into our home from the roof. Ended up dealing with Johnny M. who was extremely knowledgeable and offered great insight and advice.,-80.0862221,26.443555,158,29.603331737705783
Mr. Shrimp,4.4,First time eating here! My new favorite place!,-80.0955251,26.2913399,58,46.40997302737135
Açaí com Tapioca,4.5,"Thus place is really good, many options to choice from. It's a serve you self type of thing, which is really nice.",-80.1480662,26.3174628,58,43.69520207600806
Bonjour Vietnam,4.8,"The ingredients were fresh, but the flavor is far from traditional Vietnamese flavors. I got Shrimp vermicelli with house sauce and didn't like it that much.",-80.0825639,26.3507692,115,39.88551866356344
SeaSide Subs,4.9,Has a great selection. I highly recommend this great little sandwich shop on the beach.,-80.0829844,26.3140153,46,43.94849869580023
Smoothie King,4.1,I don't see the need to add over 30g of sugar to a small smoothie. It tastes like liquid sugar in a cup.,-80.09194,26.306961,21,44.690286845468854
Deccan Spice Pompano,4.8,This place was amazing. The minute we walked through the unassuming store front doors and were greeted by the kindest staff we knew we made a good choice.,-80.1078263,26.2167217,198,54.66333472326708
Munchys pizza and wings,4.5,"Simply AMAZING! The best pizza we have ever had, better than any place in NY or Chicago...",-80.0915131,26.3099162,78,44.36450382414855
Il Mulino New York - Boca Raton,4.2,"Before we were even asked for drinks, we were served our preference of water with bruschetta, olive focaccia, and fresh parmesan. Our captain, Ivan, took our order starting with the cold octopus salad that was on special that night, we opted also for Black Truffle Porcini Ravioli, Bolognese, and shared Rack of Lamb.",-80.07852679999999,26.3508406,58,39.904097163275495
The Standard Cuisine & Cocktails,4.4,New Chef Alert! Chef Adrienne is cranking out some super yummy new dishes!,-80.08435329999999,26.347709,58,40.21359749105133
McDonald's,3.6,I just love McDonald's new look! The service was awesome!,-80.4345835,25.4769732,1268,140.49476220298104
Pro Lab of Pompano,4.6,"Great service, friendly owners. They make the best prints!",-80.0971094,26.2322477,38,52.95207295220432
Umberto's,4.1,"My favorite meal today, the amazing Grandma pizza. Those sweet tomatoes on in, tbe smooth but earthy taste of the basil on it, just an unbelievable recipe.",-80.09555309999999,26.2316501,438,53.0213501694927
Wendy's,2.8,Great Burgers and Awesome Service,-80.1568903,26.2299369,25,53.43232019832407
Subway,3.7,Great location close to the beach. Always a great sub made just the way you want right in front of you.,-80.0963292,26.1988266,18,56.65564848271313
ASIAN DELUXE CUISINE,4.5,Authentic thai with fresh herbs. Loved it!,-80.08487699999999,26.2600153,36,49.91492366990385
The Taco Joint,4.4,Was looking for a great local taco place for my GF and I. I saw Taco Joint on Yelp. I was kinda shocked.,-80.0901848,26.2316561,48,53.034790949653605
Margarita Cantina,3.9,Had a lot of fun here! Try it out!,-80.10459809999999,26.1207875,48,65.29225721497505
H20 Breakfast Place,3.1,"What a great little find for breakfast, great prices awesome service and a wonderful View",-80.105335,26.1216041,33,65.20157131891636
Quarterdeck Restaurants,4.1,My wings were cooked well!! Bravo.,-80.1055908,26.1195488,1538,65.42922183280582
Chima Steakhouse,4.7,We attended a birthday party here this weekend and everything was wonderful. Great selection at the buffet and all the meats were very tasty.,-80.1135559,26.1196823,2258,65.41769288634188
SuperGlass Windshield Repair,4.7,Thank you Eric for the amazing job you did on our 2018 Tacoma! For anyone looking for glass repair I highly recommend this company.,-81.29924199999999,28.457994,28,226.6583595926973
Pizza City,3.8,Omg all I have to say is WHITE PIZZA! period.,-80.12814929999999,26.1194843,98,65.47062834846363
B Square Burgers,4.4,Decided to check this place out. Sat outside which was nice.,-80.13235999999999,26.119477,875,65.48639551780393
Starbucks,4.2,One of my favorite places in cities. It's a chain but so good at what it does.,-80.137046,26.122237,553,65.20074870789621
Jimmy John's,3.8,Friendly and “freaky fast”. Looking for a quick bite?,-80.1373509,26.1083526,238,66.73878333286115
Tom Jenkins BBQ,4.5,The nice woman taking orders at the counter today was a blessing! She was super sweet and uplifting.,-80.136692,26.1064851,1917,66.94251726443908
Taco Bell,3.9,I've had 2 problems my last 3 visits. They gave me completely wrong items even though the receipts were correct.,-80.1363561,26.0982277,1241,67.85500382979403
Burger King,3.3,We were told to back up after paying at drive thru.,-80.1370816,26.0998259,947,67.68128971922305
Subway,3.9,The Lad Olas Subway is always a pleasant experience. Eugene is great!,-80.1391804,26.1202446,48,65.43139334914459
Mini Pita Mediterranean Cafe,4.5,I’ve eaten here multiple times dine in and take out. I  highly recommend !,-80.1566678,26.0925938,818,68.59552042856994
Sassano's Pizza,4.4,"We ordered here for the first time,  then drove home 45 minutes to Miami,  heated up the food, and all ate. It still tasted great!",-80.17926729999999,26.1055591,103,67.36721737398211
Silverspoon Takeout,4.1,Need anything like a good shef,-80.18647729999999,26.1204737,38,65.80745632656819
Marti's New River Bistro,3.9,Restaurant was nice and with a great view. Food was very good.,-80.14879599999999,26.1192722,34,65.5931558620002
Café Roma italy,4.3,A lot of options at a good price. I can eat healthy there or dive in there.,-80.1428857,26.1229642,27,65.14978779523156
Family Bakery,4.2,"I'm here at least once a week, bread is always hot and fresh",-80.1535361,26.1379755,18,63.55822117890063
Reflexion Restaurant,4.1,Love they Food been going there since 2017.😋😋😋,-80.1474027,26.1362169,148,63.71079499112675
Downtown Auto Repair and Collision Center,4.1,"I have an older truck, it's hard to find parts for but the kept at it and it's running better than ever! Thanks guys!!",-80.15103239999999,26.1336858,85,64.01454853306959
Taco Craft Taqueria & Tequila Bar,3.9,I must say I really enjoyed the other Taco Craft location close to my home. That being said this place is so much more beautiful and welcoming and the food is just as good and the Margaritas are fantastic and I had a great time with my wife for taco Tuesday today.,-80.1372454,26.1283586,16,64.52419453108745
JBANGER SOUL Food,4.7,I went with my sister. She said the food was good.,-80.17471859999999,26.1510311,58,62.3096777645117
Krystal - Closed,3.7,Bummed this place closed! I prefer Krystal over White Castle.,-80.1542898,26.1369639,38,63.6755374668702
Las Reynas Swap Shop,3.8,Food and music was great and great service,-80.1912272,26.1372742,78,64.0206003863961
Subway,3.4,Stopped here for lunch to pick up me and Mom Subs. No complaints.,-80.1815486,26.1366958,67,63.96452655949159
Munchie's Pizza Club,4.9,"The pizzas were incredibly delicious, I tried out 3 different types, I had a pesto vegan with veggies and vegan cheese and is a very good choice for those who are vegan. This place is good for Covid-19 service, recommended spacing between people and very spacious.",-80.145793,26.1202509,158,65.46649869474342
"Friendship Café - Falafel, Shawarma & more",4.6,,-80.12958859999999,26.11921,48,65.50581040832166
Zona Fresca,4.6,I am a regular at the Pompano and N. Fort Lauderdale locations and was excited to learn this store just opened next to my office! I absolutely love the food here and the service is always excellent.,-80.1304643,26.1015569,148,67.46345221914612
South Sea Chinese Kitchen,4.3,They have provided top of the line Chinese food for like 20 yrs! Love Barbara and Chen!!,-80.1461465,26.1633134,86,60.70686934706434
Restaurant Warehouse,4.6,Great selection of kitchen wares and utensils,-80.1469506,26.1716115,14,59.79476040041635
Goji Juicery and Kitchen,4.2,"Scottie Bowl for breakfast and Tuna Wrap for lunch 😋👌 clean eats, clean restaurant, and great service",-80.13678399999999,26.112764,78,66.24798313744981
CAFE VICO RESTAURANT OCEAN,4.4,"Located at the old Nicks location, we had a very nice relaxing dinner, NY strip steak for me, chicken picatta for Les. At our request, no bread, pasta or potatoes, we asked for double broccoli, which I don't believe we received and charged $9.00 for a side salad...really?",-80.09975779999999,26.1710453,16,59.72801323422784
Mancora Ceviche Bar Fort Lauderdale,4.7,"Amazing spot! Highly recommend the pisco sour, lomo saltado, and tallarin verde with filet mignon!",-80.1052093,26.1197223,98,65.41008585862714
Hamburger Mary's Wilton Manors,3.5,Amazing brunch and burgers. Fun and entertaining atmosphere.,-80.1337209,26.1582463,75,61.20037367784569
Wendy's,3.5,"4 for $4 ...Get a JBC, Crispy Chicken Sammie or Jr. Cheeseburger w/ 4PC Nuggs, Jr. Fry & Small Drink. OR  $5 Biggie Bag complete with the Bacon Double Stack, 4 PC Nugg, fries, and a drink",-80.1265173,26.1376158,973,63.45768935676821
Cuisine Lakay,3.9,Good food.,-80.1457721,26.136936,18,63.62115988056604
Ackee Tree Jamaican Restaurant,4.0,Absolutely delicious. My 4th time here and have been beyond happy with the food and service.,-80.1715732,26.1663754,75,60.58574622510933
Danny's Kitchen,4.2,Just wow! Very delicious food and presentation is on point!!,-80.12972979999999,26.158908,18,61.11099311230069
Jade Flower,4.4,Food is always fresh. I was surprised how good their seafood is.,-80.186616,26.121707,54,65.67348905865217
Tossed,4.2,What a salad! !,-80.1133777,26.1368593,37,63.51457088723882
Twice Removed,5.0,"As a fan of Poutine, I really liked the menu at Twice Removed; there were lots of Poutine variants. We tried the Chicken Curry Poutine and the Chicken Tinga on Tostones.",-80.101817,26.169366,37,59.91196695035835
Le Marche,3.6,"Foodcwas great,service very slow and host was not friendly. Out of almost all wine, gave one entree instead of two.",-80.1035881,26.1292418,24,64.35604740553175
Roxanne's Liquor Bar & Kitchen,4.9,Pop up kitchen featuring different local chefs and great drinks makes for an amazing experience Everytime you walk through the door!!! $9 Cocktails are cheap enough to try them all!!,-80.1379954,26.1342849,46,63.87193926786703
Brooklyn Water Bagel,4.1,This is a neat place. I got the tip from guy in my therapy class.,-80.1183909,26.1551288,336,61.49789891892935
Fitlife Foods Fort Lauderdale,4.5,"I am not a good cook, I never have been, so their meals work perfectly for me. The food tastes excellent and is very filling.",-80.116552,26.1561797,53,61.37833303862283
Dunkin',3.9,This place always has a line BUT they are so quick literally u are there no longer than 2-5 min .. thank you ladies for being so quick and nice,-80.180936,26.1361665,13,64.01569035173216
Auntie Anne's,2.2,,-80.1160757,26.1687919,28,59.9804518765357
Chart House - CLOSED,3.7,We then asked the bartender for another round of drinks and had to have the check redone. Both times that we ordered drinks (for 2) we had to wait about 10 to 15 minutes.,-80.1036835,26.1651974,98,60.372521444218926
Fishtales On 33rd,4.4,"Fantastic location. Beautiful, good taste decoration.",-80.10080459999999,26.1693459,633,59.915130286109346
Oria Osteria & Terrazza,4.6,"Cabe here to meet a friend that was hosted at the hotel. I liked the place, relaxing and quiet.",-80.10333829999999,26.1698265,36,59.85986142921316
Cibo Wine Bar Ft Lauderdale,4.3,"as were the Polenta Fries. However, the bread which was described as being ""fresh"" made daily, was a bit stale.",-80.1191575,26.1787489,58,58.88302902858186
El proveedor latino super market,4.2,I like because the food is delicious and the Cervices are quick nice place,-80.1418553,26.1816663,98,58.65089281196597
Hurricane BTW,4.1,Came here on a Groupon. The food was pretty good.,-80.11054539999999,26.2006593,33,56.44400855378893
Bonefish Grill,4.4,Bang bang shrimp and everything is to indulge in. Servers are extraordinary.,-80.1074129,26.2058856,1006,55.86382364948199
Dairy Queen Grill & Chill,4.2,Sharing pictures with lobby info closed / drive thru only during COVID19 pandemic. Although the strawberry cake 🍰 cuperfection was discontinued still lots of options in their menu.,-80.1090493,26.2006521,788,56.444037696420324
Auto Critic Inc.,4.3,Great follow up service on a repeat issue. Thanks Auto critic for great service.,-80.1059319,26.2136001,33,55.009181326254385
Valentino's Italian Cuisine,3.5,This place is awesome! Rudy (the owner) has set up a nice atmosphere with excellent home cooked meals.,-80.1031074,26.2286805,88,53.33964923905422
Galuppi's,4.2,We ordered a variety of food with mix results. We sat away from the main stage which was nice to be able to enjoy the entertainment while still being able to have table take.,-80.1032376,26.2457987,1808,51.4430512229109
Miami Subs Grill,3.8,"The manager asked if order was placed at the Sample road location, sure enough our bad. I'm not from a state where there are a lot of gyros sandwich shops so without comparison it's hard for me to really offer advice.",-80.12735529999999,26.2320042,848,53.00940863084787
Wong's Chinatown Restaurant,3.7,Take out and the service good,-80.122698,26.224002,88,53.87974668948849
Auto Interiors By John O,4.5,"Update: 12 Dec 2018 Once again went back to john with a problem that most shops that are in the so-called window repair business could never fix my 1989 Gt. Took it John, and once again, he did an amazing job.",-80.1296157,26.2242698,38,53.87470515954613
Wimbos,4.3,Loaded Potatoes are beyond great! I just need the Pompano location to Get it TOGETHER!,-80.13128329999999,26.2193718,14,54.42406897104707
Glasskey Restaurant & Take-Out,4.4,This is rotisserie buffet. There is a ton of sides and rice piled on your take out tray and a stop at the salad bar included in the price.,-80.15962999999999,26.234316,38,52.975706229677954
Fern Gully Grill,3.6,DELICIOUS red pea soup & I also had the brown stew chicken which was also very tasty nice flavor and very big portion. Definitely my go to on Saturdays now.,-80.1580889,26.2317293,68,53.24593213472602
Auto Clinic USA,4.9,Danny is very professional and he give you a reasonable price. It the only place we take our vehicle.,-80.1510567,26.2614973,38,49.8972484818059
"Rapid Recovery Team, LLC.",4.9,From start to finish these guys were amazing. Professional and knowledgeable.,-80.15643469999999,26.2685903,218,49.16548490471632
Big O's IslandVybz,4.7,Legit Jamaican spot. Great food and friendly staff.,-80.1019682,26.2313404,48,53.04588984663246
Vincenzo's New York to Chicago Pizzeria,5.0,The lady over the phone was so helpful . Pizza was hot and fresh.,-80.11899009999999,26.1819325,28,58.530045065273214
Punto Gourmet,4.8,"Great place, amazing products, wonderful service",-80.1556027,26.218508,58,54.68161040194867
Madras Cafe,3.8,"I would say this is one of the better Indian restaurants in the South Florida area. Food is good, decor is excellent, even the bathroom was nicely designed.",-80.2292623,26.6831229,27,12.540532373260847
Crisp Eatery and Bar,4.8,"Awesome food, drinks and service!!! Bartender is amazing!!",-80.1542351,26.1875955,58,58.08249712746683
