name_y,avg_rating,resumen_reseñas,longitude_x,latitude_x,num_of_reviews,distancia
El Almendron Cuban Cuisine,4.6,"Excellent food, great ambience,  friendly staff.",-80.3036915,25.7611135,77,106.96220106848416
Starbucks,4.4,Could not sit inside. Team members were great!,-80.281335,25.821807,628,99.94605235361539
El Colibri Cafe,4.4,"I had the media noche sandwich, which is scrumptious! My wife had the pan con bisteck, also delicious to say the least.",-80.28822219999999,25.8294194,38,99.23889407357561
Los Hornos Restaurant,4.4,Variety of food. Very exquisite,-80.3126271,25.8159343,87,101.1752257292566
Miami Subs,4.6,"Fresher than expected, very tasty sandwiches and wraps! Soup was incredible, busy but fast and quality service.",-80.31301549999999,25.8178356,48,100.97686114886135
La Lunita Coffee Shop,4.4,Are you hiring now,-80.29936719999999,25.8415289,26,98.13201131027843
Los Martin Cafeteria,4.3,"The best pan con croqueta in all of Florida, period. Great little hole in the wall for the tired worker or anyone else for that matter.",-80.315424,25.851923,31,97.33343099681488
El Canal Cafe,4.4,Food was great. Only thing is missing is a good AC.,-80.31878309999999,25.8506059,93,97.54823620938495
Tamalito Cubano restaurants,4.9,Excelent service!!! Tasty food and the owner is very polite.,-80.3040944,25.8482706,27,97.49389548990015
Bachata Rosa,3.6,I tried this place before with a friend and I am addicted since then. I loved the good character and flavorful dishes and drinks.,-80.29977269999999,25.8481728,8,97.4182278855722
Batidos cubanos,4.6,They don't accept any credit cards. Food was good and well priced though.,-80.2893079,25.8479171,18,97.2447550012186
Lascuezas De Bellamar Llc,4.4,u gotta now tbese place if u wanna enter and be safe all night sometimes it gets pack on wikens ..,-80.288746,25.846825,34,97.35313280499464
Cortadito Café,4.6,Fast and friendly service. Food was great.,-80.2954202,25.8445133,53,97.73103789193783
Puerto Gallego Inc,4.4,Nice place. Good food.,-80.2817025,25.8405596,27,97.90732204980162
Ceviches Peru Restaurante Peruano,4.6,4.5 stars. 4 for decor and ambience; 5 for food and staff.,-80.2824577,25.8462619,244,97.2992729474557
Esquina Criolla,4.4,Great Latin food. Excellent service.,-80.2845628,25.8665506,97,95.1279580223395
Chipotle Mexican Grill,3.9,"I was the other day at this restaurant for first time here and I will not come back again. I was treated like garbage for one of the lady there, I asked for a plate and she was preparing something different and I said that was wrong and she got really mad like if she were giving me the food for free.",-80.2919284,25.8670672,913,95.21176627116786
Jerry & Joe's Pizza,4.0,"So my first & last time. They say New York style pizza, I'm from New York & their medium pizza is the size of a slice in NY.",-80.31873999999999,25.883282,126,94.01606163864598
Iceberg Rolls,4.7,First time here and loved it. The ice cream was super good and the customer service was amazing.,-80.3157038,25.876132,288,94.72095776374682
Cristy's Cafe,4.7,"The seasoning they use at this place is as good as their attention and service.Chef Cristy is passionate and sweet as the cakes she prepares.Try their Fish, their seafood and the Cuban dishes that she learned to prepare really good with a hint of her Brazilian touch.The waitresses will make you part of the family, they are always nice and ready to serve any little craving you might have.They have excellent Cuban Coffee, the best around the area!",-80.3254745,25.8627548,20,96.38374028091707
Jet Fuel Meals,4.9,"I have tried different meal prep companies, but this one is amazing! The food has tons of flavor and is very fresh.",-80.4564714,26.0177756,368,84.26723063798674
Fritanga Las Piedrecitas,4.4,"Amazing Nicaraguan food, I recommend their Carne Asada dish.",-80.331211,25.868625,236,95.88253811672203
Dunkin,3.8,Dunkin is Dunkin. Just loving it.,-80.32791689999999,25.8621043,38,96.5094516588854
La Mina Restaurante,4.3,Wow,-80.3336801,25.8688726,18,95.91379415554401
Sbarro,4.3,Strombolis are amazing!,-80.3180029,25.8684958,48,95.59689283900363
Puerquito Relleno,4.8,Roasted pig stuffed with congri rice. Pig was properly seasoned and rice was very flavorful.,-80.3389983,25.8820239,28,94.62704043305904
Domenico's 2 (Hialeah Gardens),4.3,We've been to this one in Hialeah once before a while back and decided to go again. She looked like she did not want to be there.,-80.3253399,25.8601251,68,96.66454475431334
Happy Vegan Bakers Café,4.6,"Hialeah needs more businesses like this! Great selection, affordable prices, and of course, everything vegan and free of animal cruelty.",-80.3418514,25.8971766,118,93.07142736807123
Pollo Graduado,4.1,Easy ordering pick up and the chicken and arepas combo was amazing!,-80.318551,25.822807,47,100.55246193596847
Subway,4.4,Amazing staff! They are kind and very competent.,-80.3311172,25.8834298,94,94.28599211146684
El Paponazo,4.5,I got the strawberry milkshake and it was creamy and delicious. The fries were good too and my boyfriend loved the #1 potato order.,-80.3078287,25.8847043,35,93.62292419269373
Subway,4.2,Very good customer service and clean.,-80.3320798,25.8971373,27,92.83446261630864
Belly Fuel Restaurant,5.0,The tostones con ropa vieja were really good. The waitress were really attentive.,-80.3243662,25.8569952,98,96.98061493337605
George's Shawarma inc,4.9,Nice food truck! Food was super delicious & flavorful.,-80.3257617,25.8772135,45,94.83054182393796
La Casa del Pan con Lechón,4.6,Would recommend to anyone wanting authentic Cuban food. Prices are also reasonable.,-80.3397249,25.8934901,78,93.41371699991272
5inco Restaurant,4.3,They have the best wings hands down,-80.33897859999999,25.8954245,48,93.18756126678247
Latin Cuban Cafeteria,4.3,Oh boy this is the best of real unaltered just perfect Cuban food service great too,-80.349991,25.895699,605,93.4377580483109
Papa John's Pizza,3.6,I was previously a Dominos Pizza regular customer because of their carryout large 3 topping pizza for $7.99 each special but one day my brother wanted to order Pizza from Papa John's when he came over to visit and we got a few 5 toppings large pizzas for $12 each from Papa John's. This was my first time ordering from Papa John's because I didnt think that paying their regular price of $18 per pizza was worth it but I was impressed by the taste of their pizzas when I tried them and by the fact that the Papa John pizzas also come with garlic sauce to dip the pizza bread which is something that Dominos charges extra money to add.,-80.34631639999999,25.8907065,148,93.87797962209986
Los Paraguas,4.6,If you have high standards please don't go there. If you just want to avoid starvation that's your place.,-80.34558299999999,25.8972903,48,93.15388522662171
Indio Mara Fast Food,4.6,Great,-80.3297348,25.8322696,58,99.77092051507096
Subway,4.3,"The best ever.Fresh vegetables, incredible!!!! !",-80.3498621,25.8977338,117,93.21668383070407
"Rokascudo ""El Principe""",5.0,Just great,-80.3173936,25.8257262,37,100.21193339043344
Nuevo Amanecer Cafe,4.5,"Great food for the third time we ordered from this place. La picadera was made with fresh meat, plantains and cheese.",-80.3556365,25.8918495,126,93.9971617326428
Goldo Pasao,4.4,Best Hot dog in town,-80.32978609999999,25.8337817,28,99.60874464276336
El Chalet Restaurant,4.4,Breakfast are excellent. Good service.,-80.35633849999999,25.8777904,87,95.51887734784266
Denny's,4.1,It was good. The service was super fast.,-80.3567369,25.8805297,1077,95.23627709136981
SHIK-SHAK,4.7,Found this gem while in Miami and it was nothing but amazing! The burgers were so yummy & so were the shawarmas.,-80.1923745,25.8010482,47,101.07641175060407
Eight Bistro Lounge,4.6,Great place to go out and get food,-80.3572185,25.8264509,27,101.04366286645379
Un Pollo at The Doral Yard,4.6,"This place is amazing, the ambience and the attention is just Stellar. The food tastes amazing, everything is Spectacular.",-80.3357624,25.820116,38,101.21842014617965
Marco's Pizza,4.7,Delicious pizza made to perfection. Great taste .,-80.35212,25.881641,58,94.99753004157228
La Bambina Pizza,4.9,"La mejor pizza cubana , defitnely should try it , friendly staff , great Hialeah vibe , the chocolate icecream shake is the bomb , cleanness is at his best and the variety of the menu make you feel like if you are in the right place , muy parecidas a las de Playa de Marianao in the old time's btw , way to go guys , keep shinning in that corner .",-80.3306673,25.8834785,88,94.27008912302972
Barbara’s cafe,4.6,Good attention reasonable friendly atmosphere,-80.2907705,25.8836844,27,93.38344116271843
Leo's Speedometer,4.7,I recommend folks go to this business. They does a wonderful job always.,-80.3304102,25.8568144,28,97.1370945647983
Arepa Point Food Truck,4.9,"Great food! Awasome flavor, right portion, good variety of meats and drink options.",-80.3377241,25.832147,98,99.96520883499
Sergio's Restaurant,3.9,I just love their dishes. I always get fantastic customer service there.,-80.3254312,25.8586326,401,96.82771926866546
Palmetto Cafe,4.4,"Palmetto Cafe is located at a gas station in Medley. They cook some fire Cuban food, must have, its a bargain and the food is always yummy.",-80.32603759999999,25.8556047,26,97.16825074332682
El Maguey on the Road,4.8,"Super good and tasty food, prices are great. I recommend them!",-80.3399534,25.876661,34,95.22658275921539
Smoothie Spot Hialeah,3.9,I ordered a berry kale smoothie and a custom bowl with steak and tuna. They have a number of additions that can be added to the bowl or smoothie.,-80.3190225,25.8539171,73,97.19531748853053
Mangia House by Juan Drake,5.0,The pizza was really good ..had the best little waitress...and we enjoyed the magic card trick by the ouwner ..awesome people,-80.3333643,25.8404569,27,98.96901381829265
Pizzamanina,4.7,Best pizza,-80.2697918,25.8228492,38,99.6375523332365
DORAL CAFE,4.7,Modern and clean cafe with beautiful views of downtown Doral. Delicious cafecito,-80.3320562,25.820416,56,101.10303132806092
Shape Lovers,3.6,"The thing with Shapelovers is they have overall their way of doing things. I give them 5 stars because the girls I have spoken to are really nice, I think with anyone, if you speak gently with them, you will get that in return.",-80.3255155,25.8231264,38,100.66649162906624
"Make It Happen Automotive, llc",4.3,These guys are terrific. 100% professional work on every car.,-80.324518,25.823212,48,100.63566140510414
Miami Excellence Collision Center,4.9,"I took my motorcycle's tank to get fix, It had multiple dents. Gustavo did a great job, tank looks awesome.",-80.32347899999999,25.824611,37,100.461907859653
Fritanga Coquito,4.5,"Great soups , good portions and decent prices .",-80.3076002,25.8643679,98,95.82035627162588
THE RITERO BURGER 🍔,4.8,"This is by far one of the best places to get real Venezuelan food, I highly recommend this place.",-80.3175062,25.8255832,76,100.22978602382963
Rancho Algibe,4.8,"I really enjoyed going to this restaurant. It's like dining with your ""Abuelita"" From the music to the food.",-80.306333,25.8555717,148,96.74751897354
Mi Pizza Piu- Miami,4.7,See this food truck when driving by and last night. As you eat it the flavor gets better and now I want to have it again.,-80.3173936,25.8257262,138,100.21193339043344
Subway,4.0,The food was good! The employees were trying their best they were just under staffed.,-80.3707029,25.8274598,47,101.27743314813567
Subway,3.8,It’s 8:10 pm right now and they are closed. I see 2 workers inside in the kitchen they are ignoring us.,-80.37121359999999,25.8393031,44,100.02424771883172
Perfect Fit Cuisine,4.8,"Even though I showed up ALMOST at closing time, ALL of the staff was SO nice and so helpful! I can't get over how much food we got at such an affordable price AND healthy!",-80.32705059999999,25.8912335,18,93.34975614880138
Jersey Mike's Subs,4.8,I eat the Philly chicken sub which is one of their healthier subs. I get it with half quantity of cheese to make it leaner.,-80.37129999999999,25.82726,36,101.31434365727024
Sal y Pimienta,3.9,Meet n greet...awesome Lots of girls to serve you Great service,-80.3668015,25.8882566,78,94.68077640788215
Super Smoothie,4.3,Finally! A healthy place to eat great food.,-80.3660307,25.8120467,33,102.80904932580529
Los Verdes Doral,3.9,This restaurant has a good variety of food. All the food items we had were very full of flavor.,-80.368866,25.812829,525,102.7968952302774
Mojitos Calle 8,4.2,"Just when I thought I had tasted all Cuban dishes around Miami, I checked out Mojitos and let me tell you anybody who is a foodie needs to come here and enjoy. Nice classics, with beef, pork and shrimp in patacones, or perhaps a nice mahi-mahi.",-80.326076,25.761918,2307,107.30861221311643
China China,4.2,Alright service,-80.3652886,25.7876822,17,105.40596376812309
Chao Cajun,4.0,Very delicious and price point is very good !,-80.3652498,25.7874608,26,105.4288015038925
BJ's Restaurant & Brewhouse,4.2,"The restaurant has a great atmosphere , all employees in general are very helpful. In general all food was delicious.",-80.3682455,25.7865087,1137,105.6046993649152
Runway Grille & Deli Restaurant,4.4,"Best food, best prices with the best service.",-80.3706916,25.777707,13,106.61018295153352
Panda Express,3.1,"Only outside eating with this high temperatures when there is no more covid restrictions here , this is dumb having clients eat outside and come in Timorese",-80.38703799999999,25.7913209,18,105.57022263509016
Sabor Cubano Cafeteria,4.7,They have the the awesome cuban menu. The staff is friendly.,-80.4050634,25.7603814,17,109.35680043740018
McDonald's,3.7,"If they don't have an item in the restaurant they WILL NOT give you a refund. The ""area supervisor"" doesn't care either.",-80.4320736,25.7604502,478,110.11537120293373
Subway,4.5,Fire that place make fresh bread cookies and the subare like wow,-80.3862666,25.747896,38,110.19801768191662
Delicias Pizzeria Cubana,4.7,Really good pizza. Guava is my favorite.,-80.3816633,25.767896,87,107.93755556734692
Rincon Caribeno,4.0,I sang karaoke  there people  love it,-80.3762636,25.7680212,14,107.78816228199501
Taco Bus Miami,4.1,"The staff was extremely friendly, and they were also offering online orders which I highly recommend if you are looking to make this a really quick stop. The chicken was perfectly seasoned and the burrito held itself extremely well keeping all of its ingredients intact.",-80.4093141,25.7605938,54,109.4506466507906
Masayita Minimarket Corporation,4.4,"A great selection of typical Nicaraguan food stuff, including cheese, sour milk, and menu for lunch or dinner. All offerings are authentic Nicaraguan style and though the prices are a bit high, they are not unreasonable.",-80.37453339999999,25.7675993,18,107.79041740836838
Diced,4.8,"For relatively healthy food, this was very good...and the service was excellent...the girls working there were very friendly which is rare in today's environment.",-80.3675614,25.7609349,24,108.33640473524143
Burger King,3.0,To the guy working in the drive through on 6.19.19 at 8:20 PM you are so rude! Came up to the window with cell phone in hand texting not even looking where he was lunging the order through the window.,-80.37265049999999,25.756429,25,108.94395717854587
Little Caesars Pizza,3.4,"The pizza is good, I mean for the price you really can’t beat it. However, the staff needs some work.",-80.367676,25.754667,328,109.01345278102158
Almazar,4.2,I can honestly say this is my favorite restaurant in all of FIU. The food is delicious amd the staff is very friendly and helpful.,-80.3727277,25.7561826,34,108.97231803537088
BurBowl,4.7,Used to like this place before Covid. I was a frequent delivery custumer but last week I went to dine in and the cashier and chef didn't wear the mask the whole time.,-80.3671306,25.7528069,248,109.20061912663144
El Toro Loco Churrascaria Bird Road Food Truck,4.4,They look like they've been sitting there since the morning. This isn't the first time.,-80.37873689999999,25.7324012,125,111.67448827111728
McDonald's,4.1,"Clean restaurant, friendly staff, hot food, and very important... clean bathroom! The tables were wiped clean and chairs in their places.",-80.4313871,25.7289571,795,113.43524594765861
Finka Table & Tap,4.5,"Loved the ambiance! Servers were well versed on menu items, very cordial and humorous!",-80.43182949999999,25.7426205,2067,111.99782843046678
Amelia's 1931,4.5,"Very limited menu that is very pricy. The food was good although I did notice it was not fresh as I sat right in front of the kitchen and saw everything, for instance the bao buns were microwaved which was really disappointing considering the price.",-80.4154844,25.7438482,455,111.40453382118837
Smoothie King,4.4,Greatest smoothie spot in Miami. Ownership is giving opportunities to these young adults who are fast as heck!,-80.42536,25.76056,38,109.90766220466875
Pho Taste,4.6,"Let’s start off by saying THIS IS AUTHENTIC! I’ve been to a few Vietnamese restaurants in south Miami, Orlando, LA and so far this place has IT when it comes to their Vietnamese Crepe!!!",-80.40035859999999,25.7297035,36,112.50823203987306
Jin Jin,4.2,Amazing food I recommend this family owned restaurant is so clean and the food is so good its  fresh and good prices family packs are huge and good variety i love this place,-80.4478875,25.7150196,78,115.39242761626105
Canton Star,4.0,"My family has been coming here for over 20 years and the food has ALWAYS been excellent! In all that time, we have never had a negative experience in any way.",-80.4473835,25.6974276,98,117.24192292158394
Andy's Pizzeria,4.6,"The best pizza in Miami! It needs no words to prove it, you have to try!",-80.44767,25.7005004,126,116.92441343137783
McDonald's,3.9,I feel that this McDonald's needs to have Corporate come and see why they are so slow in making orders and giving them out fast and correct. Cause there has been lots of time I have gone there and my order is not right or they give m3 somebody else's order.,-80.44663129999999,25.6847692,1308,118.56355627225894
Fuddruckers,4.6,"Excellent food, nice place",-80.444188,25.683802,2036,118.59661136967124
Rinconcito Paisa,4.1,"For the most part as usual, it was great. Except this time a very watery mushroom sauce didn't do the trick to be the expected chicken dish so much recommended.",-80.4381179,25.6978304,34,116.93367912541898
Burger King,3.7,All the good workers are gone. This ultimately lowered the quality of service here.,-80.4226604,25.6855766,538,117.81352112980647
Mike's Pizza of Kendall,4.5,"The food is delicious and the staff is excellent! My husband and I arrived late, thinking they were open later (our mistake), but they kindly took us in and seated us right away.",-80.41695829999999,25.6876667,698,117.43870105583795
Papa John's Pizza,4.2,This is the Papa John's to go to if you are in the area! I've ordered several times at this location and they are always on point.,-80.4176854,25.6843844,118,117.80872887401546
Marino's Pizza - Pasta,4.5,"Been a Marinos customer sine 1995, would love to eat here everyday. Pizzas are fabulous, pasta even better and for a quick bit the subs are delicious.",-80.4195481,25.6859278,348,117.69304787615351
Sabor Venezolano Kendall,4.4,The best breakfast in Kendall. Excellent food for excellent prices combined with superb service.,-80.41848639999999,25.6842857,956,117.84041295067362
Con Sabor A Cafe,4.4,Went in at 9:15AM They do not offer any dine in service and refused to let me use their bathroom as well. Doesn’t seem to be any reason to go there.,-80.417304,25.6786137,108,118.4157248777352
Fit4u Healthy Food & More,4.8,"I just found my new favorite burger spot! The food was delicious, the staff was extremely friendly and humble, and the prices were very comfortable.",-80.4207296,25.7060295,109,115.57883236404935
Asian Spices,4.0,"Okay store, but should probably change the name. People might get confused and think it's an oriental market.",-80.4207007,25.7062426,28,115.55531892138079
Carvel,4.7,Excellent customer service and closes much later than most Carvels in Kendall. The bossman always has a great attitude!,-80.4321164,25.7129735,58,115.15435583871083
McDonald's,4.1,"I received me food, opened the sandwich and noticed they gave me the wrong one. They took it back and the ""manager"" returned it to the food warmer to give to someone else.",-80.4159985,25.7141067,638,114.58919108661235
Smoothie King,4.2,"Chocolate banana acai vegan smoothie 😍 it taste just like a chocolate protein bar. The staff member who took my order, a young lady, was such a delight and helped me choose my shake",-80.36641999999999,25.701363,98,114.72906086848197
Ali's Sweet Treats,4.3,Yesterday was my daughter bday I order 6 cupcakes and 6 cookies and cake of paw patrol. Everything is by email with in my opinion is impossible make orders and made possible understand what really someone wants.,-80.3828941,25.7023655,92,115.00461457068145
Pisco Y Nazca Ceviche Gastrobar,4.5,"I had walked by and asked if reservations were required she informed Yes, and the place was absolutely full. as this was our very first time and not familiar with the menu, she was definitely familiar and steered us in the right direction.",-80.38604219999999,25.6892341,1800,116.49273174493887
Subway,3.4,"Made Fresh- Great Taste, Great Value",-80.38809619999999,25.6898643,26,116.47429836662265
Chuck E. Cheese,4.4,"Extremely happy with my experience! The server was amazing, very attentive and helpful.",-80.3923317,25.687653,1028,116.81477815262659
American Karate Institute,4.8,"I am coming back after 4 years of reviewing to say that this place has taught me values I have since taken for granted until I had realised how often I used them in my day to day life. Knowing how to fight is excellent, but learning core values such as integrity, hard work, and devotion are priceless.",-80.406002,25.664929,127,119.59249311550614
Isla Del Encanto,4.5,I love this place. It is hard to find authentic Puerto Rican food and this is legit .,-80.401299,25.6563489,25,120.39756451267723
Bonefish Grill,4.5,It's pretty good but (a little) pricey. Had some weird interaction with a waiter where when I asked for the check they told me to wait and think about desert...,-80.39643889999999,25.6555459,1301,120.36610580790496
Smoothie Spot Crossings,3.7,You can taste the freshness of the ingredients The restaurant is located next to Dunkin’ Donuts on 120st in a small plaza that If you’re driving too fast you will pass the entrance.,-80.4052002,25.6562844,28,120.50040458384497
KIMBOP,4.9,I was so happy to find great Korean food in Miami and so lucky that it is so close to my house! I really enjoyed the couple platter and the bonus Korean dessert.,-80.4193572,25.6338138,74,123.2655870515519
Lazeez Cuisine,4.5,"Super Excellence Food, the boss is the chief, first time come here, when I arrived here, I saw no people in the restaurant ( I come at 19:30), I am a little bit scary, but I try, because I read the other people comment, when I ate my food in there, I saw a lot of people to order take away, Until I finished my food, I tell you I am highly recommend this restaurant. ( You can see the photo.)",-80.4208087,25.7061839,38,115.56450964583655
El Ventorrillo Bistro,4.9,"On a busy day like mother's day there were only two waiters, no hostess. Food took forever, lacked flavor, and was overcooked.",-80.4193043,25.7229284,48,113.73830242364527
Snapper Creek Service Plaza,4.2,"We always stop here on our road trips heading south. They have a gas station with a small store with snacks, coffee and drinks.",-80.3870614,25.6618608,625,119.46377126855027
Pao Pao Fast Food,4.7,"Wow is what I said every time I took a bite of something. Everything was fresh, full of flavor and just overall fantastic.",-80.407719,25.6558081,118,120.61407168259899
Ceviche Bowl,4.8,Best flavors. Better than most high end restaurants,-80.40554499999999,25.653432,68,120.81519898830132
LNB GROVESTAND,4.9,I highly recommend the turmeric concentrate. I love the taste and it makes my aching joints feel better.,-80.4122651,25.6418459,15,122.22575495522356
Fritanga Kendall Grille,4.5,I’ve been here a few times and the food is good. I haven’t ordered from the menu because the buffet looks good at lunch.,-80.3916991,25.6506999,74,120.77484902087424
El Floridita Seafood Restaurant - Kendall,4.4,For a bill over $300.00  I would have appreciated good customer service and a fully cooked meals. 4 adult meals & 2 children meals.,-80.4129389,25.6413325,1140,122.29767873344368
Sabores latinos,4.6,Great juices and looking forward to getting a lunch from them my next time in the area,-80.4226462,25.6360192,58,123.11307750143756
1821 Sandwich Shop,4.0,"Great food truck, reasonable prices and delicious tastes!",-80.41617769999999,25.6812065,48,118.1089415288391
UniClean Carpet & Upholstery Cleaning,5.0,"From the moment we contacted Uniclean, we were treated with exceptional customer service. Friendly individuals, trustworthy and hard working.",-80.4244697,25.6405165,178,122.67847113902727
La Tinajita Cafe,4.5,This place is amazing would definitely recommend.,-80.423214,25.639067,144,122.80125244700699
Gusto's Latin Food,4.6,Good food and excellent service. It's a couple that work the restaurant and the food is a combination of Colombian and Venezuelan cuisine.,-80.3933373,25.6628753,48,119.50324101551291
Crafty Crab - Sunset,4.6,"After visiting the Chinese in this same strip mall for so long, we decided to give this place a try. Outside look does the inside no justice.",-80.36848739999999,25.7019446,208,114.71319852227911
Makan Miami Food truck,4.9,"Restaurant service, gourmet food, incredible vibe. All of that in a soon-to-be restaurant food-truck.",-80.38126199999999,25.6859044,138,116.73784034864137
